{
  "$schema": "https://json-schema.org/draft/2020-12/schema",
  "$id": "https://promptsyntax.org/conformance/case-family/0.1-draft",
  "title": "PromptSyntax conformance case family",
  "type": "object",
  "additionalProperties": false,
  "required": ["format_version", "id", "version", "status", "profile", "target", "cases"],
  "properties": {
    "format_version": { "const": "0.1-draft" },
    "id": { "type": "string", "pattern": "^[a-z0-9][a-z0-9-]+$" },
    "version": { "type": "string", "minLength": 1 },
    "status": { "enum": ["candidate", "normative"] },
    "profile": { "type": "string", "pattern": "^[a-z0-9][a-z0-9-]+$" },
    "target": { "enum": ["trace-document", "trace-producer"] },
    "cases": {
      "type": "array",
      "minItems": 1,
      "items": { "$ref": "#/$defs/case" }
    }
  },
  "$defs": {
    "case": {
      "type": "object",
      "additionalProperties": false,
      "required": ["id", "description", "requirements", "trace", "expected"],
      "properties": {
        "id": { "type": "string", "pattern": "^[a-z0-9][a-z0-9-]+$" },
        "description": { "type": "string", "minLength": 1 },
        "requirements": {
          "type": "array",
          "minItems": 1,
          "uniqueItems": true,
          "items": { "type": "string", "pattern": "^PS-[A-Z0-9-]+$" }
        },
        "trace": { "type": "string", "minLength": 1 },
        "patch": {
          "type": "array",
          "items": { "$ref": "#/$defs/patch_operation" }
        },
        "transcript": { "type": "string", "minLength": 1 },
        "transcript_patch": {
          "type": "array",
          "items": { "$ref": "#/$defs/patch_operation" }
        },
        "expected": {
          "type": "object",
          "additionalProperties": false,
          "required": ["conformant", "diagnostics"],
          "properties": {
            "conformant": { "type": "boolean" },
            "diagnostics": {
              "type": "array",
              "uniqueItems": true,
              "items": { "type": "string", "pattern": "^[A-Z][A-Z0-9_]+$" }
            }
          }
        }
      }
    },
    "patch_operation": {
      "oneOf": [
        {
          "type": "object",
          "additionalProperties": false,
          "required": ["op", "path", "value"],
          "properties": {
            "op": { "enum": ["add", "replace"] },
            "path": { "type": "string", "pattern": "^/" },
            "value": true
          }
        },
        {
          "type": "object",
          "additionalProperties": false,
          "required": ["op", "path"],
          "properties": {
            "op": { "const": "remove" },
            "path": { "type": "string", "pattern": "^/" }
          }
        }
      ]
    }
  }
}
